{
  "$schema": "./newsletter.schema.json",
  "template": "brain-dead-template",
  "title": "Four Books From Near Future Laboratory",
  "preheader": "A compact sales email starter for the four-book offer.",
  "brand": {
    "name": "Near Future Laboratory",
    "logoUrl": "https://dummyimage.com/180x60/000000/ffffff.png&text=NFL",
    "logoAlt": "Near Future Laboratory",
    "logoWidth": 96,
    "logoLink": {
      "href": "https://example.com/?nav=home",
      "label": "four-books | header logo",
      "category": "site-nav"
    },
    "navLinks": [
      {
        "label": "Shop",
        "url": {
          "href": "https://example.com/?nav=shop",
          "label": "four-books | header shop",
          "category": "commerce"
        }
      }
    ]
  },
  "hero": {
    "eyebrow": "Four books",
    "headline": "A field kit for near-future thinking.",
    "subhead": "Four printed references for research, design fiction, strategy, and useful speculation.",
    "body": "Use this slot for the sales note: why these four books belong together, who they are for, and what changes when someone has them on the desk.",
    "image": "https://dummyimage.com/1200x760/f2ff3d/000000.png&text=FOUR+BOOKS",
    "imageAlt": "The four books arranged together",
    "ctaText": "Shop the set",
    "ctaLink": {
      "href": "https://example.com/?offer=four-books-hero",
      "label": "four-books | hero CTA",
      "category": "commerce",
      "interest": "books-writing",
      "intent": "purchase"
    }
  },
  "booksLabel": "Included in the set",
  "books": [
    {
      "kicker": "Book 01",
      "title": "Book One Title",
      "subtitle": "Replace this with the first book subtitle.",
      "body": "A short sales paragraph for the first book. Keep it specific to what the reader can use it for.",
      "image": "https://dummyimage.com/376x520/ffffff/000000.png&text=BOOK+01",
      "imageAlt": "Cover of Book One Title",
      "price": "$00",
      "link": {
        "href": "https://example.com/?book=one",
        "label": "four-books | Book One Title",
        "category": "commerce",
        "interest": "books-writing",
        "intent": "purchase"
      },
      "ctaText": "View book one"
    },
    {
      "kicker": "Book 02",
      "title": "Book Two Title",
      "subtitle": "Replace this with the second book subtitle.",
      "body": "A short sales paragraph for the second book. Name the reader, use case, or decision it helps with.",
      "image": "https://dummyimage.com/376x520/000000/ffffff.png&text=BOOK+02",
      "imageAlt": "Cover of Book Two Title",
      "price": "$00",
      "link": {
        "href": "https://example.com/?book=two",
        "label": "four-books | Book Two Title",
        "category": "commerce",
        "interest": "books-writing",
        "intent": "purchase"
      },
      "ctaText": "View book two"
    },
    {
      "kicker": "Book 03",
      "title": "Book Three Title",
      "subtitle": "Replace this with the third book subtitle.",
      "body": "A short sales paragraph for the third book. Mention the artifact, method, or project it contains.",
      "image": "https://dummyimage.com/376x520/f2ff3d/000000.png&text=BOOK+03",
      "imageAlt": "Cover of Book Three Title",
      "price": "$00",
      "link": {
        "href": "https://example.com/?book=three",
        "label": "four-books | Book Three Title",
        "category": "commerce",
        "interest": "books-writing",
        "intent": "purchase"
      },
      "ctaText": "View book three"
    },
    {
      "kicker": "Book 04",
      "title": "Book Four Title",
      "subtitle": "Replace this with the fourth book subtitle.",
      "body": "A short sales paragraph for the fourth book. Make the reason to own it easy to scan.",
      "image": "https://dummyimage.com/376x520/ffffff/000000.png&text=BOOK+04",
      "imageAlt": "Cover of Book Four Title",
      "price": "$00",
      "link": {
        "href": "https://example.com/?book=four",
        "label": "four-books | Book Four Title",
        "category": "commerce",
        "interest": "books-writing",
        "intent": "purchase"
      },
      "ctaText": "View book four"
    }
  ],
  "offer": {
    "eyebrow": "Set offer",
    "headline": "Buy all four together.",
    "body": "Use this final block for bundle pricing, shipping timing, signed-copy language, or a deadline.",
    "ctaText": "Shop all four",
    "ctaLink": {
      "href": "https://example.com/?offer=four-books-footer",
      "label": "four-books | bundle CTA",
      "category": "commerce",
      "interest": "books-writing",
      "intent": "purchase"
    }
  },
  "footer": {
    "footerCta": {
      "enabled": false
    },
    "paragraphs": [
      "You are receiving this because you subscribed to Near Future Laboratory updates.",
      "Questions about the books or shipping? Reply to this email."
    ],
    "address": "Near Future Laboratory, Venice Beach, California",
    "socialLinks": [
      {
        "label": "Website",
        "url": {
          "href": "https://example.com/?social=website",
          "label": "four-books | footer website",
          "category": "site-nav"
        }
      }
    ],
    "unsubscribeLabel": "Unsubscribe",
    "unsubscribeLink": "[unsubscribe]"
  }
}
